{"catalogSha256":"61f806345dd38980db0fdfef7a3dbfd2cbe3c47f822e5287dc50d40db4efba60","catalogSignatureUrl":"https://github.com/mohdakil2426/Pixel-AutoPIF/releases/download/v1/pixel-catalog-v1.json.sig","catalogSizeBytes":707,"catalogUrl":"https://github.com/mohdakil2426/Pixel-AutoPIF/releases/download/v1/pixel-catalog-v1.json","catalogVersion":1,"expiresAt":"2026-08-29T00:00:00Z","generatedAt":"2026-07-30T00:00:00Z","keyId":"pixel-autopif-p256-v1","schemaVersion":1}
